TIME, DESCRIPT
21:57,seleciona o item a a caixa de texo do jogo pergunta quantos desses itens você quer jogar no chão e aí ele aperta paraa
22:03,baixo ef tá lá o menos 44 ao confirmar essa escolha o jogo não entende como é
22:09,possível derrubar menos 44 titanitos então ao invés de derrubar o jogo dá para ele essa mesma quantidade não não
22:15,não não não não acredito o que aconteceu aqui é que lá atrás quando kiwi Tentou comprar de novo a luva ele forçou na
22:22,memória do jogo Aquele cálculo de luvas lembra uma luva menos as 45 que ele
22:27,comprou como ele ele não pode ter mais de uma o jogo então armazenou na memória que ele tinha esse número de -44 e uma
22:33,hora ou outra o jogo teria que usar esse número em algum lugar então ao fazer esse truque de trocas de menu aqui ele faz com que o jogo Traga de Volta o
22:40,número menos 44 só que dessa vez nessa situação onde ele tá tentando derrubar itens E aí no caso ele vai tentar
